╔══════════════════════════════════════════════════════════╗
║      TSZ Conformance Runner (Docker + WASM)             ║
╠══════════════════════════════════════════════════════════╣
║  Tests:      500                                         ║
║  Workers:    2                                           ║
║  Categories: conformance,compiler,projects               ║
║  Timeout:    600s                                        ║
╚══════════════════════════════════════════════════════════╝

📦 Building WASM...
[INFO]: 🎯  Checking for the Wasm target...
[INFO]: 🌀  Compiling to Wasm...
   Compiling wasm v0.1.0 (/Users/mohsenazimi/code/tsz)
warning: constant `MAX_CLASS_INHERITANCE_DEPTH` is never used
  --> src/checker/class_type.rs:23:7
   |
23 | const MAX_CLASS_INHERITANCE_DEPTH: usize = 256;
   |       ^^^^^^^^^^^^^^^^^^^^^^^^^^^
   |
   = note: `#[warn(dead_code)]` (part of `#[warn(unused)]`) on by default

warning: methods `create_flow_evaluator`, `extract_flow_facts`, and `apply_solver_flow_narrowing` are never used
    --> src/checker/flow_analysis.rs:1693:19
     |
  91 | impl<'a> CheckerState<'a> {
     | ------------------------- methods in this implementation
...
1693 |     pub(crate) fn create_flow_evaluator(&self) -> FlowTypeEvaluator<'_> {
     |                   ^^^^^^^^^^^^^^^^^^^^^
...
1703 |     pub(crate) fn extract_flow_facts(&self, _sym_id: SymbolId, _usage_idx: NodeIndex) -> FlowFacts {
     |                   ^^^^^^^^^^^^^^^^^^
...
1719 |     pub(crate) fn apply_solver_flow_narrowing(
     |                   ^^^^^^^^^^^^^^^^^^^^^^^^^^^

warning: field `db` is never read
   --> src/solver/flow_analysis.rs:111:5
    |
110 | pub struct FlowTypeEvaluator<'a> {
    |            ----------------- field in this struct
111 |     db: &'a dyn TypeDatabase,
    |     ^^

warning: `wasm` (lib) generated 3 warnings
    Finished `release` profile [optimized] target(s) in 2.63s
[INFO]: Optional fields missing from Cargo.toml: 'description', 'repository', and 'license'. These are not necessary, but recommended
[INFO]: ✨   Done in 2.91s
[INFO]: 📦   Your wasm pkg is ready to publish at /Users/mohsenazimi/code/tsz/pkg.
[WARN]: ⚠️   There's a newer version of wasm-pack available, the new version is: 0.14.0, you are using: 0.13.1. To update, navigate to: https://rustwasm.github.io/wasm-pack/installer/
✅ WASM built
📦 Copying TypeScript lib files (source)...

📦 Building conformance runner...
✅ Runner built

🐳 Preparing Docker image...
✅ Docker ready

🚀 Running tests in Docker (WASM)...
   (Memory: 4GB, CPUs: 2, Timeout: 600s)

[36m╔══════════════════════════════════════════════════════════╗[0m
[36m║    High-Performance Parallel Conformance Test Runner     ║[0m
[36m╚══════════════════════════════════════════════════════════╝[0m
[36m
Collecting test files...[0m
[2m  conformance: 167 files[0m
[2m  compiler: 167 files[0m
[2m  projects: 144 files[0m
[36m  Total: 478 test files[0m
[2m  Workers: 2 | Timeout: 10000ms[0m
[32m
Using TSC cache: 12053 tests cached[0m
[2m  Generated: 2026-01-22T22:59:34.277Z[0m
[36m
Initializing 2 workers...[0m
[32m  Workers ready![0m
[36m
Running tests...[0m
  Progress: 1/478 (0.2%) | 2/s | 0.5s      Progress: 2/478 (0.4%) | 4/s | 0.5s      Progress: 3/478 (0.6%) | 3/s | 0.9s      Progress: 4/478 (0.8%) | 4/s | 0.9s      Progress: 5/478 (1.0%) | 4/s | 1.2s      Progress: 6/478 (1.3%) | 5/s | 1.2s      Progress: 7/478 (1.5%) | 5/s | 1.4s      Progress: 8/478 (1.7%) | 6/s | 1.4s      Progress: 9/478 (1.9%) | 5/s | 1.7s      Progress: 10/478 (2.1%) | 6/s | 1.7s      Progress: 11/478 (2.3%) | 6/s | 2.0s      Progress: 12/478 (2.5%) | 6/s | 2.0s      Progress: 13/478 (2.7%) | 6/s | 2.2s      Progress: 14/478 (2.9%) | 6/s | 2.2s      Progress: 15/478 (3.1%) | 6/s | 2.5s      Progress: 16/478 (3.3%) | 6/s | 2.5s      Progress: 17/478 (3.6%) | 6/s | 2.7s      Progress: 18/478 (3.8%) | 7/s | 2.7s      Progress: 19/478 (4.0%) | 6/s | 3.0s      Progress: 20/478 (4.2%) | 7/s | 3.0s      Progress: 21/478 (4.4%) | 7/s | 3.2s      Progress: 22/478 (4.6%) | 7/s | 3.4s      Progress: 23/478 (4.8%) | 7/s | 3.5s      Progress: 24/478 (5.0%) | 7/s | 3.6s      Progress: 25/478 (5.2%) | 7/s | 3.8s      Progress: 26/478 (5.4%) | 7/s | 3.9s      Progress: 27/478 (5.6%) | 7/s | 4.1s      Progress: 28/478 (5.9%) | 7/s | 4.2s      Progress: 29/478 (6.1%) | 7/s | 4.4s      Progress: 30/478 (6.3%) | 7/s | 4.5s      Progress: 31/478 (6.5%) | 7/s | 4.6s      Progress: 32/478 (6.7%) | 7/s | 4.7s      Progress: 33/478 (6.9%) | 7/s | 4.9s      Progress: 34/478 (7.1%) | 7/s | 5.0s      Progress: 35/478 (7.3%) | 7/s | 5.0s      Progress: 36/478 (7.5%) | 7/s | 5.1s      Progress: 37/478 (7.7%) | 7/s | 5.1s      Progress: 38/478 (7.9%) | 7/s | 5.1s      Progress: 39/478 (8.2%) | 8/s | 5.2s      Progress: 40/478 (8.4%) | 8/s | 5.2s      Progress: 41/478 (8.6%) | 8/s | 5.2s      Progress: 42/478 (8.8%) | 8/s | 5.2s      Progress: 43/478 (9.0%) | 8/s | 5.2s      Progress: 44/478 (9.2%) | 8/s | 5.2s      Progress: 45/478 (9.4%) | 9/s | 5.3s      Progress: 46/478 (9.6%) | 9/s | 5.3s      Progress: 47/478 (9.8%) | 9/s | 5.3s      Progress: 48/478 (10.0%) | 9/s | 5.3s      Progress: 49/478 (10.3%) | 9/s | 5.3s      Progress: 50/478 (10.5%) | 9/s | 5.4s      Progress: 51/478 (10.7%) | 9/s | 5.4s      Progress: 52/478 (10.9%) | 10/s | 5.4s      Progress: 53/478 (11.1%) | 10/s | 5.4s      Progress: 54/478 (11.3%) | 10/s | 5.4s      Progress: 55/478 (11.5%) | 10/s | 5.4s      Progress: 56/478 (11.7%) | 10/s | 5.5s      Progress: 57/478 (11.9%) | 10/s | 5.5s      Progress: 58/478 (12.1%) | 11/s | 5.5s      Progress: 59/478 (12.3%) | 11/s | 5.5s      Progress: 60/478 (12.6%) | 11/s | 5.5s      Progress: 61/478 (12.8%) | 11/s | 5.5s      Progress: 62/478 (13.0%) | 11/s | 5.6s      Progress: 63/478 (13.2%) | 11/s | 5.6s      Progress: 64/478 (13.4%) | 11/s | 5.6s      Progress: 65/478 (13.6%) | 12/s | 5.6s      Progress: 66/478 (13.8%) | 12/s | 5.6s      Progress: 67/478 (14.0%) | 12/s | 5.6s      Progress: 68/478 (14.2%) | 12/s | 5.7s      Progress: 69/478 (14.4%) | 12/s | 5.7s      Progress: 70/478 (14.6%) | 12/s | 5.7s      Progress: 71/478 (14.9%) | 12/s | 5.7s      Progress: 72/478 (15.1%) | 12/s | 5.8s      Progress: 73/478 (15.3%) | 13/s | 5.8s      Progress: 74/478 (15.5%) | 13/s | 5.8s      Progress: 75/478 (15.7%) | 13/s | 5.8s      Progress: 76/478 (15.9%) | 13/s | 5.8s      Progress: 77/478 (16.1%) | 13/s | 5.8s      Progress: 78/478 (16.3%) | 13/s | 5.8s      Progress: 79/478 (16.5%) | 13/s | 5.9s      Progress: 80/478 (16.7%) | 14/s | 5.9s      Progress: 81/478 (16.9%) | 14/s | 5.9s      Progress: 82/478 (17.2%) | 14/s | 5.9s      Progress: 83/478 (17.4%) | 14/s | 5.9s      Progress: 84/478 (17.6%) | 14/s | 6.0s      Progress: 85/478 (17.8%) | 14/s | 6.0s      Progress: 86/478 (18.0%) | 14/s | 6.0s      Progress: 87/478 (18.2%) | 15/s | 6.0s      Progress: 88/478 (18.4%) | 15/s | 6.0s      Progress: 89/478 (18.6%) | 15/s | 6.0s      Progress: 90/478 (18.8%) | 15/s | 6.1s      Progress: 91/478 (19.0%) | 15/s | 6.1s      Progress: 92/478 (19.2%) | 15/s | 6.1s      Progress: 93/478 (19.5%) | 15/s | 6.1s      Progress: 94/478 (19.7%) | 15/s | 6.1s      Progress: 95/478 (19.9%) | 15/s | 6.1s      Progress: 96/478 (20.1%) | 16/s | 6.2s      Progress: 97/478 (20.3%) | 16/s | 6.2s      Progress: 98/478 (20.5%) | 16/s | 6.2s      Progress: 99/478 (20.7%) | 16/s | 6.2s      Progress: 100/478 (20.9%) | 16/s | 6.2s      Progress: 101/478 (21.1%) | 16/s | 6.2s      Progress: 102/478 (21.3%) | 16/s | 6.3s      Progress: 103/478 (21.5%) | 16/s | 6.3s      Progress: 104/478 (21.8%) | 17/s | 6.3s      Progress: 105/478 (22.0%) | 17/s | 6.3s      Progress: 106/478 (22.2%) | 17/s | 6.3s      Progress: 107/478 (22.4%) | 17/s | 6.3s      Progress: 108/478 (22.6%) | 17/s | 6.4s      Progress: 109/478 (22.8%) | 17/s | 6.4s      Progress: 110/478 (23.0%) | 17/s | 6.4s      Progress: 111/478 (23.2%) | 17/s | 6.4s      Progress: 112/478 (23.4%) | 17/s | 6.5s      Progress: 113/478 (23.6%) | 17/s | 6.5s      Progress: 114/478 (23.8%) | 18/s | 6.5s      Progress: 115/478 (24.1%) | 18/s | 6.5s      Progress: 116/478 (24.3%) | 18/s | 6.5s      Progress: 117/478 (24.5%) | 18/s | 6.6s      Progress: 118/478 (24.7%) | 18/s | 6.6s      Progress: 119/478 (24.9%) | 18/s | 6.6s      Progress: 120/478 (25.1%) | 18/s | 6.6s      Progress: 121/478 (25.3%) | 18/s | 6.7s      Progress: 122/478 (25.5%) | 18/s | 6.7s      Progress: 123/478 (25.7%) | 18/s | 6.7s      Progress: 124/478 (25.9%) | 18/s | 6.7s      Progress: 125/478 (26.2%) | 18/s | 6.8s      Progress: 126/478 (26.4%) | 19/s | 6.8s      Progress: 127/478 (26.6%) | 19/s | 6.8s      Progress: 128/478 (26.8%) | 19/s | 6.8s      Progress: 129/478 (27.0%) | 19/s | 6.9s      Progress: 130/478 (27.2%) | 19/s | 6.9s      Progress: 131/478 (27.4%) | 19/s | 6.9s      Progress: 132/478 (27.6%) | 19/s | 6.9s      Progress: 133/478 (27.8%) | 19/s | 7.0s      Progress: 134/478 (28.0%) | 19/s | 7.0s      Progress: 135/478 (28.2%) | 19/s | 7.0s      Progress: 136/478 (28.5%) | 19/s | 7.0s      Progress: 137/478 (28.7%) | 20/s | 7.0s      Progress: 138/478 (28.9%) | 19/s | 7.4s      Progress: 139/478 (29.1%) | 19/s | 7.4s      Progress: 140/478 (29.3%) | 18/s | 7.7s      Progress: 141/478 (29.5%) | 18/s | 7.8s      Progress: 142/478 (29.7%) | 18/s | 7.8s      Progress: 143/478 (29.9%) | 18/s | 7.9s      Progress: 144/478 (30.1%) | 18/s | 7.9s      Progress: 145/478 (30.3%) | 18/s | 7.9s      Progress: 146/478 (30.5%) | 18/s | 7.9s      Progress: 147/478 (30.8%) | 18/s | 8.0s      Progress: 148/478 (31.0%) | 19/s | 8.0s      Progress: 149/478 (31.2%) | 19/s | 8.0s      Progress: 150/478 (31.4%) | 19/s | 8.0s      Progress: 151/478 (31.6%) | 19/s | 8.0s      Progress: 152/478 (31.8%) | 19/s | 8.1s      Progress: 153/478 (32.0%) | 19/s | 8.1s      Progress: 154/478 (32.2%) | 19/s | 8.1s      Progress: 155/478 (32.4%) | 19/s | 8.1s      Progress: 156/478 (32.6%) | 19/s | 8.1s      Progress: 157/478 (32.8%) | 19/s | 8.1s      Progress: 158/478 (33.1%) | 19/s | 8.2s      Progress: 159/478 (33.3%) | 19/s | 8.2s      Progress: 160/478 (33.5%) | 20/s | 8.2s      Progress: 161/478 (33.7%) | 20/s | 8.2s      Progress: 162/478 (33.9%) | 20/s | 8.2s      Progress: 163/478 (34.1%) | 20/s | 8.2s      Progress: 164/478 (34.3%) | 20/s | 8.2s      Progress: 165/478 (34.5%) | 20/s | 8.3s      Progress: 166/478 (34.7%) | 20/s | 8.3s      Progress: 167/478 (34.9%) | 20/s | 8.3s      Progress: 168/478 (35.1%) | 20/s | 8.3s      Progress: 169/478 (35.4%) | 20/s | 8.3s      Progress: 170/478 (35.6%) | 20/s | 8.4s      Progress: 171/478 (35.8%) | 20/s | 8.4s      Progress: 172/478 (36.0%) | 20/s | 8.4s      Progress: 173/478 (36.2%) | 21/s | 8.4s      Progress: 174/478 (36.4%) | 21/s | 8.4s      Progress: 175/478 (36.6%) | 21/s | 8.4s      Progress: 176/478 (36.8%) | 21/s | 8.4s      Progress: 177/478 (37.0%) | 21/s | 8.5s      Progress: 178/478 (37.2%) | 21/s | 8.5s      Progress: 179/478 (37.4%) | 21/s | 8.5s      Progress: 180/478 (37.7%) | 21/s | 8.5s      Progress: 181/478 (37.9%) | 21/s | 8.5s      Progress: 182/478 (38.1%) | 21/s | 8.5s      Progress: 183/478 (38.3%) | 21/s | 8.6s      Progress: 184/478 (38.5%) | 21/s | 8.6s      Progress: 185/478 (38.7%) | 22/s | 8.6s      Progress: 186/478 (38.9%) | 22/s | 8.6s      Progress: 187/478 (39.1%) | 22/s | 8.6s      Progress: 188/478 (39.3%) | 22/s | 8.6s      Progress: 189/478 (39.5%) | 22/s | 8.7s      Progress: 190/478 (39.7%) | 22/s | 8.7s      Progress: 191/478 (40.0%) | 22/s | 8.7s      Progress: 192/478 (40.2%) | 22/s | 8.7s      Progress: 193/478 (40.4%) | 22/s | 8.7s      Progress: 194/478 (40.6%) | 22/s | 8.7s      Progress: 195/478 (40.8%) | 22/s | 8.7s      Progress: 196/478 (41.0%) | 22/s | 8.8s      Progress: 197/478 (41.2%) | 22/s | 8.8s      Progress: 198/478 (41.4%) | 22/s | 9.0s      Progress: 199/478 (41.6%) | 22/s | 9.1s      Progress: 200/478 (41.8%) | 22/s | 9.3s      Progress: 201/478 (42.1%) | 22/s | 9.3s      Progress: 202/478 (42.3%) | 21/s | 9.5s      Progress: 203/478 (42.5%) | 21/s | 9.6s      Progress: 204/478 (42.7%) | 21/s | 9.8s      Progress: 205/478 (42.9%) | 21/s | 9.9s      Progress: 206/478 (43.1%) | 21/s | 10.0s      Progress: 207/478 (43.3%) | 21/s | 10.1s      Progress: 208/478 (43.5%) | 20/s | 10.3s      Progress: 209/478 (43.7%) | 20/s | 10.3s      Progress: 210/478 (43.9%) | 20/s | 10.6s      Progress: 211/478 (44.1%) | 20/s | 10.6s      Progress: 212/478 (44.4%) | 19/s | 10.9s      Progress: 213/478 (44.6%) | 20/s | 10.9s      Progress: 214/478 (44.8%) | 19/s | 11.2s      Progress: 215/478 (45.0%) | 19/s | 11.2s      Progress: 216/478 (45.2%) | 19/s | 11.4s      Progress: 217/478 (45.4%) | 19/s | 11.5s      Progress: 218/478 (45.6%) | 19/s | 11.7s      Progress: 219/478 (45.8%) | 19/s | 11.8s      Progress: 220/478 (46.0%) | 18/s | 12.0s      Progress: 221/478 (46.2%) | 18/s | 12.0s      Progress: 222/478 (46.4%) | 18/s | 12.2s      Progress: 223/478 (46.7%) | 18/s | 12.3s      Progress: 224/478 (46.9%) | 18/s | 12.5s      Progress: 225/478 (47.1%) | 18/s | 12.6s      Progress: 226/478 (47.3%) | 18/s | 12.7s      Progress: 227/478 (47.5%) | 18/s | 12.8s      Progress: 228/478 (47.7%) | 18/s | 12.8s      Progress: 229/478 (47.9%) | 18/s | 12.8s      Progress: 230/478 (48.1%) | 18/s | 12.8s      Progress: 231/478 (48.3%) | 18/s | 12.9s      Progress: 232/478 (48.5%) | 18/s | 12.9s      Progress: 233/478 (48.7%) | 18/s | 12.9s      Progress: 234/478 (49.0%) | 18/s | 12.9s      Progress: 235/478 (49.2%) | 18/s | 12.9s      Progress: 236/478 (49.4%) | 18/s | 13.0s      Progress: 237/478 (49.6%) | 18/s | 13.0s      Progress: 238/478 (49.8%) | 18/s | 13.0s      Progress: 239/478 (50.0%) | 18/s | 13.0s      Progress: 240/478 (50.2%) | 18/s | 13.0s      Progress: 241/478 (50.4%) | 19/s | 13.0s      Progress: 242/478 (50.6%) | 19/s | 13.1s      Progress: 243/478 (50.8%) | 19/s | 13.1s      Progress: 244/478 (51.0%) | 19/s | 13.1s      Progress: 245/478 (51.3%) | 19/s | 13.1s      Progress: 246/478 (51.5%) | 19/s | 13.1s      Progress: 247/478 (51.7%) | 19/s | 13.2s      Progress: 248/478 (51.9%) | 19/s | 13.2s      Progress: 249/478 (52.1%) | 19/s | 13.2s      Progress: 250/478 (52.3%) | 19/s | 13.2s      Progress: 251/478 (52.5%) | 19/s | 13.2s      Progress: 252/478 (52.7%) | 19/s | 13.2s      Progress: 253/478 (52.9%) | 19/s | 13.3s      Progress: 254/478 (53.1%) | 19/s | 13.3s      Progress: 255/478 (53.3%) | 19/s | 13.3s      Progress: 256/478 (53.6%) | 19/s | 13.3s      Progress: 257/478 (53.8%) | 19/s | 13.3s      Progress: 258/478 (54.0%) | 19/s | 13.4s      Progress: 259/478 (54.2%) | 19/s | 13.4s      Progress: 260/478 (54.4%) | 19/s | 13.4s      Progress: 261/478 (54.6%) | 19/s | 13.4s      Progress: 262/478 (54.8%) | 20/s | 13.4s      Progress: 263/478 (55.0%) | 20/s | 13.5s      Progress: 264/478 (55.2%) | 20/s | 13.5s      Progress: 265/478 (55.4%) | 20/s | 13.5s      Progress: 266/478 (55.6%) | 20/s | 13.5s      Progress: 267/478 (55.9%) | 20/s | 13.5s      Progress: 268/478 (56.1%) | 20/s | 13.6s      Progress: 269/478 (56.3%) | 20/s | 13.6s      Progress: 270/478 (56.5%) | 20/s | 13.6s      Progress: 271/478 (56.7%) | 20/s | 13.6s      Progress: 272/478 (56.9%) | 20/s | 13.6s      Progress: 273/478 (57.1%) | 20/s | 13.6s      Progress: 274/478 (57.3%) | 20/s | 13.7s      Progress: 275/478 (57.5%) | 20/s | 13.7s      Progress: 276/478 (57.7%) | 20/s | 13.7s      Progress: 277/478 (57.9%) | 20/s | 13.7s      Progress: 278/478 (58.2%) | 20/s | 13.7s      Progress: 279/478 (58.4%) | 20/s | 13.7s      Progress: 280/478 (58.6%) | 20/s | 13.8s      Progress: 281/478 (58.8%) | 20/s | 13.8s      Progress: 282/478 (59.0%) | 20/s | 13.8s      Progress: 283/478 (59.2%) | 21/s | 13.8s      Progress: 284/478 (59.4%) | 21/s | 13.8s      Progress: 285/478 (59.6%) | 21/s | 13.8s      Progress: 286/478 (59.8%) | 21/s | 13.9s      Progress: 287/478 (60.0%) | 21/s | 13.9s      Progress: 288/478 (60.3%) | 21/s | 13.9s      Progress: 289/478 (60.5%) | 21/s | 13.9s      Progress: 290/478 (60.7%) | 21/s | 13.9s      Progress: 291/478 (60.9%) | 21/s | 14.0s      Progress: 292/478 (61.1%) | 21/s | 14.0s      Progress: 293/478 (61.3%) | 21/s | 14.0s      Progress: 294/478 (61.5%) | 21/s | 14.0s      Progress: 295/478 (61.7%) | 21/s | 14.0s      Progress: 296/478 (61.9%) | 21/s | 14.1s      Progress: 297/478 (62.1%) | 21/s | 14.1s      Progress: 298/478 (62.3%) | 21/s | 14.1s      Progress: 299/478 (62.6%) | 21/s | 14.1s      Progress: 300/478 (62.8%) | 21/s | 14.1s      Progress: 301/478 (63.0%) | 21/s | 14.1s      Progress: 302/478 (63.2%) | 21/s | 14.2s      Progress: 303/478 (63.4%) | 21/s | 14.2s      Progress: 304/478 (63.6%) | 21/s | 14.2s      Progress: 305/478 (63.8%) | 21/s | 14.2s      Progress: 306/478 (64.0%) | 22/s | 14.2s      Progress: 307/478 (64.2%) | 22/s | 14.2s      Progress: 308/478 (64.4%) | 22/s | 14.3s      Progress: 309/478 (64.6%) | 22/s | 14.3s      Progress: 310/478 (64.9%) | 22/s | 14.3s      Progress: 311/478 (65.1%) | 22/s | 14.3s      Progress: 312/478 (65.3%) | 22/s | 14.3s      Progress: 313/478 (65.5%) | 22/s | 14.4s      Progress: 314/478 (65.7%) | 22/s | 14.4s      Progress: 315/478 (65.9%) | 22/s | 14.4s      Progress: 316/478 (66.1%) | 22/s | 14.4s      Progress: 317/478 (66.3%) | 22/s | 14.4s      Progress: 318/478 (66.5%) | 22/s | 14.4s      Progress: 319/478 (66.7%) | 22/s | 14.5s      Progress: 320/478 (66.9%) | 22/s | 14.5s      Progress: 321/478 (67.2%) | 22/s | 14.5s      Progress: 322/478 (67.4%) | 22/s | 14.5s      Progress: 323/478 (67.6%) | 22/s | 14.5s      Progress: 324/478 (67.8%) | 22/s | 14.5s      Progress: 325/478 (68.0%) | 22/s | 14.6s      Progress: 326/478 (68.2%) | 22/s | 14.6s      Progress: 327/478 (68.4%) | 22/s | 14.6s      Progress: 328/478 (68.6%) | 22/s | 14.6s      Progress: 329/478 (68.8%) | 23/s | 14.6s      Progress: 330/478 (69.0%) | 22/s | 14.7s      Progress: 331/478 (69.2%) | 23/s | 14.7s      Progress: 332/478 (69.5%) | 23/s | 14.7s      Progress: 333/478 (69.7%) | 23/s | 14.7s      Progress: 334/478 (69.9%) | 23/s | 14.7s      Progress: 335/478 (70.1%) | 23/s | 14.7s      Progress: 336/478 (70.3%) | 23/s | 14.8s      Progress: 337/478 (70.5%) | 23/s | 14.8s      Progress: 338/478 (70.7%) | 23/s | 14.8s      Progress: 339/478 (70.9%) | 23/s | 14.8s      Progress: 340/478 (71.1%) | 23/s | 14.8s      Progress: 341/478 (71.3%) | 23/s | 14.9s      Progress: 342/478 (71.5%) | 23/s | 14.9s      Progress: 343/478 (71.8%) | 23/s | 14.9s      Progress: 344/478 (72.0%) | 23/s | 14.9s      Progress: 345/478 (72.2%) | 23/s | 14.9s      Progress: 346/478 (72.4%) | 23/s | 14.9s      Progress: 347/478 (72.6%) | 23/s | 15.0s      Progress: 348/478 (72.8%) | 23/s | 15.0s      Progress: 349/478 (73.0%) | 23/s | 15.0s      Progress: 350/478 (73.2%) | 23/s | 15.0s      Progress: 351/478 (73.4%) | 23/s | 15.0s      Progress: 352/478 (73.6%) | 23/s | 15.0s      Progress: 353/478 (73.8%) | 23/s | 15.1s      Progress: 354/478 (74.1%) | 23/s | 15.1s      Progress: 355/478 (74.3%) | 24/s | 15.1s      Progress: 356/478 (74.5%) | 24/s | 15.1s      Progress: 357/478 (74.7%) | 24/s | 15.1s      Progress: 358/478 (74.9%) | 24/s | 15.1s      Progress: 359/478 (75.1%) | 24/s | 15.2s      Progress: 360/478 (75.3%) | 24/s | 15.2s      Progress: 361/478 (75.5%) | 23/s | 15.5s      Progress: 362/478 (75.7%) | 23/s | 15.6s      Progress: 363/478 (75.9%) | 23/s | 15.8s      Progress: 364/478 (76.2%) | 23/s | 15.8s      Progress: 365/478 (76.4%) | 23/s | 16.1s      Progress: 366/478 (76.6%) | 23/s | 16.2s      Progress: 367/478 (76.8%) | 22/s | 16.4s      Progress: 368/478 (77.0%) | 22/s | 16.5s      Progress: 369/478 (77.2%) | 22/s | 16.7s      Progress: 370/478 (77.4%) | 22/s | 16.8s      Progress: 371/478 (77.6%) | 22/s | 16.9s      Progress: 372/478 (77.8%) | 22/s | 17.1s      Progress: 373/478 (78.0%) | 22/s | 17.2s      Progress: 374/478 (78.2%) | 22/s | 17.3s      Progress: 375/478 (78.5%) | 22/s | 17.3s      Progress: 376/478 (78.7%) | 22/s | 17.5s      Progress: 377/478 (78.9%) | 21/s | 17.6s      Progress: 378/478 (79.1%) | 21/s | 17.8s      Progress: 379/478 (79.3%) | 21/s | 18.0s      Progress: 380/478 (79.5%) | 21/s | 18.1s      Progress: 381/478 (79.7%) | 21/s | 18.4s      Progress: 382/478 (79.9%) | 21/s | 18.4s      Progress: 383/478 (80.1%) | 20/s | 18.8s      Progress: 384/478 (80.3%) | 20/s | 18.9s      Progress: 385/478 (80.5%) | 20/s | 19.2s      Progress: 386/478 (80.8%) | 20/s | 19.2s      Progress: 387/478 (81.0%) | 20/s | 19.5s      Progress: 388/478 (81.2%) | 20/s | 19.6s      Progress: 389/478 (81.4%) | 20/s | 19.8s      Progress: 390/478 (81.6%) | 20/s | 19.9s      Progress: 391/478 (81.8%) | 19/s | 20.1s      Progress: 392/478 (82.0%) | 19/s | 20.2s      Progress: 393/478 (82.2%) | 19/s | 20.4s      Progress: 394/478 (82.4%) | 19/s | 20.5s      Progress: 395/478 (82.6%) | 19/s | 20.5s      Progress: 396/478 (82.8%) | 19/s | 20.6s      Progress: 397/478 (83.1%) | 19/s | 20.8s      Progress: 398/478 (83.3%) | 19/s | 20.9s      Progress: 399/478 (83.5%) | 19/s | 21.1s      Progress: 400/478 (83.7%) | 19/s | 21.2s      Progress: 401/478 (83.9%) | 19/s | 21.4s      Progress: 402/478 (84.1%) | 19/s | 21.5s      Progress: 403/478 (84.3%) | 19/s | 21.7s      Progress: 404/478 (84.5%) | 19/s | 21.8s      Progress: 405/478 (84.7%) | 18/s | 22.0s      Progress: 406/478 (84.9%) | 18/s | 22.1s      Progress: 407/478 (85.1%) | 18/s | 22.2s      Progress: 408/478 (85.4%) | 18/s | 22.4s      Progress: 409/478 (85.6%) | 18/s | 22.6s      Progress: 410/478 (85.8%) | 18/s | 22.7s      Progress: 411/478 (86.0%) | 18/s | 22.9s      Progress: 412/478 (86.2%) | 18/s | 23.0s      Progress: 413/478 (86.4%) | 18/s | 23.1s      Progress: 414/478 (86.6%) | 18/s | 23.2s      Progress: 415/478 (86.8%) | 18/s | 23.5s      Progress: 416/478 (87.0%) | 18/s | 23.6s      Progress: 417/478 (87.2%) | 18/s | 23.8s      Progress: 418/478 (87.4%) | 18/s | 23.9s      Progress: 419/478 (87.7%) | 17/s | 24.0s      Progress: 420/478 (87.9%) | 17/s | 24.2s      Progress: 421/478 (88.1%) | 17/s | 24.3s      Progress: 422/478 (88.3%) | 17/s | 24.5s      Progress: 423/478 (88.5%) | 17/s | 24.5s      Progress: 424/478 (88.7%) | 17/s | 24.8s      Progress: 425/478 (88.9%) | 17/s | 24.8s      Progress: 426/478 (89.1%) | 17/s | 25.1s      Progress: 427/478 (89.3%) | 17/s | 25.1s      Progress: 428/478 (89.5%) | 17/s | 25.2s      Progress: 429/478 (89.7%) | 17/s | 25.2s      Progress: 430/478 (90.0%) | 17/s | 25.2s      Progress: 431/478 (90.2%) | 17/s | 25.2s      Progress: 432/478 (90.4%) | 17/s | 25.3s      Progress: 433/478 (90.6%) | 17/s | 25.3s      Progress: 434/478 (90.8%) | 17/s | 25.3s      Progress: 435/478 (91.0%) | 17/s | 25.3s      Progress: 436/478 (91.2%) | 17/s | 25.4s      Progress: 437/478 (91.4%) | 17/s | 25.4s      Progress: 438/478 (91.6%) | 17/s | 25.4s      Progress: 439/478 (91.8%) | 17/s | 25.4s      Progress: 440/478 (92.1%) | 17/s | 25.5s      Progress: 441/478 (92.3%) | 17/s | 25.5s      Progress: 442/478 (92.5%) | 17/s | 25.5s      Progress: 443/478 (92.7%) | 17/s | 25.5s      Progress: 444/478 (92.9%) | 17/s | 25.5s      Progress: 445/478 (93.1%) | 17/s | 25.6s      Progress: 446/478 (93.3%) | 17/s | 25.6s      Progress: 447/478 (93.5%) | 17/s | 25.6s      Progress: 448/478 (93.7%) | 17/s | 25.6s      Progress: 449/478 (93.9%) | 17/s | 25.7s      Progress: 450/478 (94.1%) | 18/s | 25.7s      Progress: 451/478 (94.4%) | 18/s | 25.7s      Progress: 452/478 (94.6%) | 18/s | 25.7s      Progress: 453/478 (94.8%) | 18/s | 25.8s      Progress: 454/478 (95.0%) | 18/s | 25.8s      Progress: 455/478 (95.2%) | 18/s | 25.8s      Progress: 456/478 (95.4%) | 18/s | 25.8s      Progress: 457/478 (95.6%) | 18/s | 25.8s      Progress: 458/478 (95.8%) | 18/s | 25.9s      Progress: 459/478 (96.0%) | 18/s | 25.9s      Progress: 460/478 (96.2%) | 18/s | 25.9s      Progress: 461/478 (96.4%) | 17/s | 26.4s      Progress: 462/478 (96.7%) | 18/s | 26.4s      Progress: 463/478 (96.9%) | 17/s | 26.8s      Progress: 464/478 (97.1%) | 17/s | 26.8s      Progress: 465/478 (97.3%) | 17/s | 27.1s      Progress: 466/478 (97.5%) | 17/s | 27.1s      Progress: 467/478 (97.7%) | 17/s | 27.1s      Progress: 468/478 (97.9%) | 17/s | 27.1s      Progress: 469/478 (98.1%) | 17/s | 27.1s      Progress: 470/478 (98.3%) | 17/s | 27.2s      Progress: 471/478 (98.5%) | 17/s | 27.2s      Progress: 472/478 (98.7%) | 17/s | 27.2s      Progress: 473/478 (99.0%) | 17/s | 27.5s      Progress: 474/478 (99.2%) | 17/s | 27.6s      Progress: 475/478 (99.4%) | 17/s | 27.8s      Progress: 476/478 (99.6%) | 17/s | 27.8s      Progress: 477/478 (99.8%) | 17/s | 28.1s      Progress: 478/478 (100.0%) | 17/s | 28.1s                                                                                                        [2m
════════════════════════════════════════════════════════════[0m
[1mCONFORMANCE TEST RESULTS[0m
[2m════════════════════════════════════════════════════════════[0m
[33m
Pass Rate: 30.3% (145/478)[0m
[2mTime: 28.1s (17 tests/sec)[0m
[1m
Summary:[0m
[32m  ✓ Passed:   145[0m
[31m  ✗ Failed:   333[0m
[2m  💥 Crashed:  0[0m
[2m  💾 OOM:      0[0m
[2m  ⏱ Timeout:  0[0m
[1m
Worker Health:[0m
[2m  Spawned:   2[0m
[2m  Crashed:   0[0m
[2m  Respawned: 0[0m
[1m
By Category:[0m
[33m  conformance: 26/167 (15.6%)[0m
[33m  projects: 54/144 (37.5%)[0m
[33m  compiler: 65/167 (38.9%)[0m
[1m
Top Missing Errors:[0m
[33m  TS2318: 131x[0m
[33m  TS18048: 58x[0m
[33m  TS2488: 56x[0m
[33m  TS2304: 26x[0m
[33m  TS6053: 24x[0m
[33m  TS2583: 20x[0m
[33m  TS2552: 16x[0m
[33m  TS2792: 16x[0m
[1m
Top Extra Errors:[0m
[33m  TS2339: 451x[0m
[33m  TS2749: 260x[0m
[33m  TS2322: 177x[0m
[33m  TS7010: 176x[0m
[33m  TS2571: 137x[0m
[33m  TS2507: 122x[0m
[33m  TS2304: 101x[0m
[33m  TS2307: 79x[0m
[2m
════════════════════════════════════════════════════════════[0m
